<?xml version="1.0" encoding="UTF-8"?>
<!ELEMENT news (new*)>
<!ELEMENT new (title, body)>
<!ELEMENT title (#PCDATA)>
<!ELEMENT body (para*)>
<!ELEMENT para (#PCDATA)>